{
  "schema_version": "1.0.0",
  "metadata_version": "0.1.0",
  "namespace": "sottr",
  "items": {
    "0x439B19A6": {
      "internal_id": "0x439B19A6",
      "aliases": ["spanish_mission_incan_advanced_2", "CollectibleTypeMonolith_SpanishMission_IncánAdvanced_02"],
      "display_name": "圣胡安石碑（人工简名）",
      "display_language": "zh-Hans",
      "name_source": "src:plan-0.4-table",
      "name_kind": "curated_short",
      "category_id": "monoliths",
      "region_id": "mission_of_san_juan",
      "applicability": {
        "game": "sottr",
        "platform": "windows_steam",
        "mode": "campaign",
        "build_range": null,
        "dlc": null,
        "notes": ["构建范围未知", "内部名不等于游戏正式名称"]
      },
      "location_mappings": [
        {
          "mapping_kind": "guide_group_membership",
          "region_id": "mission_of_san_juan",
          "guide_group_id": "stella:san-juan-murals",
          "guide_item": null,
          "target_count": 1,
          "coordinates": null,
          "map_transform": null,
          "applicable_mode": "campaign",
          "applicable_platform": null,
          "source_refs": ["src:stella-san-juan"]
        }
      ],
      "source_refs": ["src:trrebootmodtools-dict", "src:stella-san-juan"],
      "review": {
        "state": "draft",
        "note": "攻略组关联已记录；ID 到攻略编号的一对一映射未建立",
        "date": "2026-10-13"
      }
    },
    "0x0F28B6EC": {
      "internal_id": "0x0F28B6EC",
      "aliases": ["CollectibleTypeSurvivalCache_SpanishMission_03"],
      "display_name": null,
      "display_language": null,
      "name_source": null,
      "name_kind": "unknown",
      "category_id": "survival_caches",
      "region_id": "mission_of_san_juan",
      "applicability": {
        "game": "sottr",
        "platform": null,
        "mode": null,
        "build_range": null,
        "dlc": null,
        "notes": []
      },
      "location_mappings": [
        {
          "mapping_kind": "guide_group_membership",
          "region_id": "mission_of_san_juan",
          "guide_group_id": "stella:san-juan-caches",
          "guide_item": null,
          "target_count": 8,
          "coordinates": null,
          "map_transform": null,
          "applicable_mode": "campaign",
          "applicable_platform": null,
          "source_refs": ["src:stella-san-juan"]
        }
      ],
      "source_refs": ["src:trrebootmodtools-dict"],
      "review": null
    },
    "0xDD26A1BC": {
      "internal_id": "0xDD26A1BC",
      "aliases": ["CollectibleTypeSurvivalCache_CT_Serpent_Hollow_01"],
      "display_name": "自噬河贮藏点（人工简名）",
      "display_language": "zh-Hans",
      "name_source": "src:plan-0.4-table",
      "name_kind": "curated_short",
      "category_id": "survival_caches",
      "region_id": null,
      "applicability": {
        "game": "sottr",
        "platform": "windows_steam",
        "mode": "campaign",
        "build_range": null,
        "dlc": null,
        "notes": ["区域未解决，保留为 null"]
      },
      "location_mappings": [],
      "source_refs": ["src:plan-0.4-table"],
      "review": {
        "state": "draft",
        "note": "区域与攻略条目未解决",
        "date": "2026-10-13"
      }
    }
  },
  "categories": {
    "survival_caches": {
      "category_id": "survival_caches",
      "display_name": "贮藏点（内部类别）",
      "source_refs": ["src:trrebootmodtools-dict"]
    },
    "rare_resource_caches": {
      "category_id": "rare_resource_caches",
      "display_name": null,
      "source_refs": ["src:trrebootmodtools-dict"]
    },
    "monoliths": {
      "category_id": "monoliths",
      "display_name": null,
      "source_refs": ["src:trrebootmodtools-dict"]
    },
    "crypt_treasures": {
      "category_id": "crypt_treasures",
      "display_name": null,
      "source_refs": ["src:trrebootmodtools-dict"]
    }
  },
  "regions": {
    "mission_of_san_juan": {
      "region_id": "mission_of_san_juan",
      "display_name": "圣胡安教团任务",
      "source_refs": ["src:plan-0.4-table"]
    },
    "paititi": {
      "region_id": "paititi",
      "display_name": null,
      "source_refs": ["src:plan-0.4-table"]
    }
  },
  "guide_groups": {
    "stella:san-juan-caches": {
      "guide_group_id": "stella:san-juan-caches",
      "display_name": "圣胡安贮藏点攻略组",
      "region_id": "mission_of_san_juan",
      "category_ids": ["survival_caches", "rare_resource_caches"],
      "member_ids": ["0x0F28B6EC", "0x0F28B6ED", "0x0F28B6EE"],
      "target_count": 8,
      "mapping_kind": "guide_group_membership",
      "source_refs": ["src:stella-san-juan"]
    },
    "stella:san-juan-murals": {
      "guide_group_id": "stella:san-juan-murals",
      "display_name": "圣胡安石碑攻略组",
      "region_id": "mission_of_san_juan",
      "category_ids": ["monoliths"],
      "member_ids": ["0x439B19A6"],
      "target_count": 1,
      "mapping_kind": "guide_group_membership",
      "source_refs": ["src:stella-san-juan"]
    }
  },
  "reference_sets": {
    "rs:stella-100pct-common": {
      "reference_set_id": "rs:stella-100pct-common",
      "version": "1.0.0",
      "category_ids": ["survival_caches", "rare_resource_caches", "monoliths", "crypt_treasures"],
      "source_save_hashes": [
        "1111111111111111111111111111111111111111111111111111111111111111",
        "2222222222222222222222222222222222222222222222222222222222222222"
      ],
      "dedup_rule": "集合去重；重复记录保留但只计一次唯一 ID",
      "source_refs": ["src:stella-saves"]
    }
  },
  "sources": {
    "src:trrebootmodtools-dict": {
      "url": "https://github.com/arcusmaximus/TrRebootModTools",
      "fixed_revision": "a79c48b75f1ffaaf623dc73a625211bf98ff0504",
      "accessed": "2026-10-11",
      "license": "MIT",
      "redistributable": "yes",
      "method": "内部 ID 与名称字典转录",
      "review": "许可与固定提交已复核"
    },
    "src:stella-san-juan": {
      "url": "https://tombraiders.net/stella/walks/TR11walk/collectibles/13-san-juan-murals-caches.html",
      "fixed_revision": null,
      "accessed": "2026-10-11",
      "license": null,
      "redistributable": "pending",
      "method": "攻略组与来源链接引用",
      "review": "仅引用链接，不打包攻略内容"
    },
    "src:stella-saves": {
      "url": "https://tombraiders.net/stella/savegame/TR11saves.html",
      "fixed_revision": null,
      "accessed": "2026-10-11",
      "license": null,
      "redistributable": "pending",
      "method": "公开参考存档来源与哈希",
      "review": "公开存档不随产品分发"
    },
    "src:plan-0.4-table": {
      "url": null,
      "fixed_revision": "sottr-explorer_开发方案.md v0.4 (2026-10-11)",
      "accessed": "2026-10-13",
      "license": null,
      "redistributable": "pending",
      "method": "方案文档内部名称片段转录",
      "review": "人工简名，不是已验证的游戏正式名称"
    }
  }
}
